{
  "$schema": "https://json-schema.org/draft/2020-12/schema",
  "$id": "https://raw.githubusercontent.com/renezander030/agent-approval-gate/v3.3.0/schemas/dispatch-record.schema.json",
  "title": "DispatchRecord",
  "description": "An append-only record for one deterministic dispatch attempt or reconciliation result. outcome_unknown is never an invitation to retry blindly.",
  "type": "object",
  "required": [
    "schema_version",
    "dispatch_id",
    "proposal_id",
    "request_id",
    "approval_ids",
    "action_hash",
    "idempotency_key",
    "attempt",
    "max_attempts",
    "status",
    "retry_allowed",
    "started_at",
    "recorded_at"
  ],
  "additionalProperties": false,
  "properties": {
    "schema_version": {"$ref": "common.schema.json#/$defs/schema_version"},
    "dispatch_id": {"$ref": "common.schema.json#/$defs/identifier"},
    "previous_dispatch_id": {"$ref": "common.schema.json#/$defs/identifier"},
    "proposal_id": {"$ref": "common.schema.json#/$defs/identifier"},
    "request_id": {"$ref": "common.schema.json#/$defs/identifier"},
    "approval_ids": {
      "type": "array",
      "minItems": 0,
      "maxItems": 16,
      "uniqueItems": true,
      "items": {"$ref": "common.schema.json#/$defs/identifier"}
    },
    "authority_snapshot_id": {"$ref": "common.schema.json#/$defs/identifier"},
    "action_hash": {"$ref": "common.schema.json#/$defs/digest"},
    "idempotency_key": {"$ref": "common.schema.json#/$defs/identifier"},
    "attempt": {"type": "integer", "minimum": 1},
    "max_attempts": {"type": "integer", "minimum": 1, "maximum": 20},
    "status": {
      "type": "string",
      "enum": [
        "not_dispatched",
        "succeeded",
        "failed",
        "outcome_unknown",
        "reconciled_succeeded",
        "reconciled_not_applied"
      ]
    },
    "retry_allowed": {"type": "boolean"},
    "started_at": {"type": "string", "format": "date-time"},
    "completed_at": {"type": "string", "format": "date-time"},
    "recorded_at": {"type": "string", "format": "date-time"},
    "reason": {
      "type": "string",
      "enum": [
        "approval_missing",
        "approval_expired",
        "approval_replayed",
        "action_hash_mismatch",
        "payload_hash_mismatch",
        "policy_mismatch",
        "authority_revoked",
        "authority_unknown",
        "authority_check_failed",
        "provider_rejected",
        "provider_timeout",
        "provider_response_lost",
        "attempt_limit",
        "dispatcher_error",
        "approval_rejected",
        "approval_cancelled",
        "approval_revoked",
        "request_failed",
        "precondition_failed"
      ]
    },
    "provider": {
      "type": "object",
      "additionalProperties": false,
      "properties": {
        "provider_name": {"type": "string", "minLength": 1, "maxLength": 128},
        "request_id": {"type": "string", "minLength": 1, "maxLength": 256},
        "result_hash": {"$ref": "common.schema.json#/$defs/digest"},
        "external_refs": {
          "type": "array",
          "maxItems": 20,
          "items": {"type": "string", "minLength": 1, "maxLength": 512}
        }
      }
    },
    "reconciliation": {
      "type": "object",
      "required": ["lookup_key_hash", "status"],
      "additionalProperties": false,
      "properties": {
        "lookup_key_hash": {"$ref": "common.schema.json#/$defs/digest"},
        "status": {
          "type": "string",
          "enum": ["pending", "succeeded", "not_applied", "unavailable"]
        },
        "checked_at": {"type": "string", "format": "date-time"},
        "evidence": {"$ref": "common.schema.json#/$defs/evidence_reference"}
      }
    },
    "precondition_check": {
      "description": "The dispatcher's check of the proposal's target_precondition immediately before invocation.",
      "type": "object",
      "required": ["checked_at", "result"],
      "additionalProperties": false,
      "properties": {
        "checked_at": {"type": "string", "format": "date-time"},
        "result": {"type": "string", "enum": ["matched", "changed", "unavailable"]},
        "observed_hash": {"$ref": "common.schema.json#/$defs/digest"}
      }
    },
    "execution_grant": {
      "description": "What the dispatcher hands the provider or tool with the invocation: the RFC 8785/SHA-256 digest of the grant manifest (request_id, dispatch_id, proposal_id, action_hash, sorted approval_ids, authority_snapshot_id, idempotency_key, attempt), issued after the authority check and before the invocation.",
      "type": "object",
      "required": ["digest", "issued_at"],
      "additionalProperties": false,
      "properties": {
        "digest": {"$ref": "common.schema.json#/$defs/digest"},
        "issued_at": {"type": "string", "format": "date-time"}
      }
    }
  },
  "allOf": [
    {
      "if": {
        "properties": {"status": {"enum": ["not_dispatched", "failed"]}},
        "required": ["status"]
      },
      "then": {"required": ["completed_at", "reason"]}
    },
    {
      "if": {"properties": {"status": {"const": "succeeded"}}, "required": ["status"]},
      "then": {
        "required": ["completed_at", "provider"],
        "properties": {"retry_allowed": {"const": false}}
      }
    },
    {
      "if": {
        "properties": {"status": {"const": "outcome_unknown"}},
        "required": ["status"]
      },
      "then": {
        "required": ["completed_at", "reason", "reconciliation"],
        "properties": {
          "retry_allowed": {"const": false},
          "reconciliation": {
            "properties": {"status": {"enum": ["pending", "unavailable"]}}
          }
        }
      }
    },
    {
      "if": {
        "properties": {
          "status": {"enum": ["reconciled_succeeded", "reconciled_not_applied"]}
        },
        "required": ["status"]
      },
      "then": {"required": ["completed_at", "reconciliation"]}
    },
    {
      "if": {
        "properties": {"status": {"const": "reconciled_succeeded"}},
        "required": ["status"]
      },
      "then": {
        "properties": {
          "retry_allowed": {"const": false},
          "reconciliation": {
            "properties": {"status": {"const": "succeeded"}},
            "required": ["checked_at", "evidence"]
          }
        }
      }
    },
    {
      "if": {
        "properties": {"status": {"const": "reconciled_not_applied"}},
        "required": ["status"]
      },
      "then": {
        "properties": {
          "reconciliation": {
            "properties": {"status": {"const": "not_applied"}},
            "required": ["checked_at", "evidence"]
          }
        }
      }
    },
    {
      "if": {
        "properties": {
          "status": {
            "const": "not_dispatched"
          }
        },
        "required": [
          "status"
        ]
      },
      "then": {
        "properties": {
          "retry_allowed": {
            "const": false
          }
        },
        "not": {
          "required": [
            "provider"
          ]
        }
      },
      "else": {
        "properties": {
          "approval_ids": {
            "minItems": 1
          }
        }
      }
    },
    {
      "if": {
        "properties": {"status": {"enum": ["succeeded", "failed", "outcome_unknown"]}},
        "required": ["status"]
      },
      "then": {"required": ["authority_snapshot_id"]},
      "else": {"not": {"required": ["execution_grant"]}}
    }
  ]
}
