{
  "schema_version": "3.2.0",
  "dispatch_id": "dispatch_2026-04-28_4ad31000",
  "proposal_id": "prop_2026-04-28_b3f1a2c4",
  "request_id": "req_2026-04-28_6a2d8800",
  "approval_ids": [
    "approval_2026-04-28_f9821000"
  ],
  "authority_snapshot_id": "authority_2026-04-28_9bc31000",
  "action_hash": "sha256:2991d5f888b4369ae368a0e1effa0d4c9e74fe4ddf8c607ab96849aba0b28691",
  "idempotency_key": "idem_email_ZD-48211_reply_01",
  "attempt": 1,
  "max_attempts": 3,
  "status": "succeeded",
  "retry_allowed": false,
  "started_at": "2026-04-28T09:14:33Z",
  "completed_at": "2026-04-28T09:14:34Z",
  "recorded_at": "2026-04-28T09:14:34Z",
  "provider": {
    "provider_name": "synthetic-email-provider",
    "request_id": "provider_req_20260428_8821",
    "result_hash": "sha256:78b0436944885eb78c09ea1a657e2d2c57b0d9672a19f709e6724c22a633a29b",
    "external_refs": [
      "message:<result-8821@acme-corp.example>"
    ]
  },
  "execution_grant": {
    "digest": "sha256:5302c0282c8cd362c27fcb631741d4eb8793419a1d014ff03df95d0a16132d11",
    "issued_at": "2026-04-28T09:14:33Z"
  }
}
